channel_id,workbench_constructs,response_prompt,response_type,scale_or_labels,coding_target,notes
reference_identification,reference_tracking_success,Who does the target pro-form refer to? How confident are you?,forced_choice_plus_confidence,"referent options; confidence 1-7",reference_success,Score separately from acceptability and correctness.
feature_personhood_fit,pronoun_feature_alignment|personhood_ascription,Does the pro-form fit the described referent in this context?,likert,"1=does not fit; 7=fits very well",feature_fit,Use after reference identification to avoid hiding reference failure.
reported_acceptability,reported_acceptability|felt_naturalness_context,How acceptable or natural is the sentence in the stated context?,likert,"1=very unacceptable/unnatural; 7=fully acceptable/natural",acceptability,Keep prompt wording constant inside a run.
grammaticality_attribution,grammaticality_attribution,If something is wrong here, what kind of problem is it?,category,"grammar error; style/register issue; respect/policy issue; reference ambiguity; no problem; other",attribution,Allows grammar talk to diverge from reference success.
social_sanction,metalinguistic_condemnation|social_indexical_value,Would you correct, challenge, avoid, or leave this form alone in the stated situation?,category_plus_optional_reason,"correct; challenge; avoid; leave alone; depends",sanction,Separates social policing from licensing.
norm_orientation,standard_language_ideology|audience_design,Which audience, rule, or institution are you orienting to in your judgment?,category,"ordinary conversation; school correctness; workplace policy; community-local norm; personal preference; other",norm_orientation,Use to identify which norm centre drove the response.
